[
 {
  "id": "item-driftwood",
  "name": "Driftwood",
  "category": "material",
  "tier": 0,
  "text": "The sea's last deliveries, still washing loose from the flats.",
  "gather": {
   "hits": 5
  }
 },
 {
  "id": "item-wreck-timber",
  "name": "Wreck-Timber",
  "category": "material",
  "tier": 0,
  "text": "Hull planking. Someone sailed this. Build gently.",
  "gather": {
   "hits": 5
  }
 },
 {
  "id": "item-rope",
  "name": "Salt-Stiff Rope",
  "category": "material",
  "tier": 0,
  "text": "Rigging that outlived its ship."
 },
 {
  "id": "item-salt",
  "name": "Salt",
  "category": "material",
  "tier": 0,
  "stackSize": 50,
  "text": "The one thing there is no shortage of.",
  "gather": {
   "hits": 6
  }
 },
 {
  "id": "item-bronze-salvage",
  "name": "Bronze Salvage",
  "category": "material",
  "tier": 1,
  "text": "Fittings, nails, a ship's bell melted small.",
  "gather": {
   "hits": 4
  }
 },
 {
  "id": "item-ship-cloth",
  "name": "Ship-Cloth",
  "category": "material",
  "tier": 0,
  "text": "Sailcloth, faded to the color of the sky it worked under."
 },
 {
  "id": "item-coralwood",
  "name": "Coralwood",
  "category": "material",
  "tier": 2,
  "text": "Timber from a forest where every tree is a dead animal."
 },
 {
  "id": "item-reef-iron",
  "name": "Reef-Iron",
  "category": "material",
  "tier": 2,
  "text": "Ore seeded through petrified coral. The Reefkin call it 'marrow' and would rather you didn't."
 },
 {
  "id": "item-pearl",
  "name": "Pearl",
  "category": "material",
  "tier": 2,
  "text": "The reef's last soft thing."
 },
 {
  "id": "item-tidebrass",
  "name": "Tidebrass",
  "workingName": true,
  "category": "material",
  "tier": 3,
  "text": "Metal from the first-age wrecks. It remembers being wet."
 },
 {
  "id": "item-storm-glass",
  "name": "Storm-Glass",
  "category": "offering",
  "tier": 2,
  "offeringValue": 12,
  "text": "Sand fused by Maren's own hand. The priests trade sermons for it."
 },
 {
  "id": "item-trench-pearl",
  "name": "Trench Pearl",
  "category": "offering",
  "tier": 3,
  "offeringValue": 25,
  "text": "Grown in the dark by something that did not mean to make anything beautiful."
 },
 {
  "id": "item-god-water",
  "name": "God-Water",
  "category": "offering",
  "tier": 1,
  "offeringValue": 18,
  "text": "Brinefolk-distilled. The best worship offering there is — mind how you came by it."
 },
 {
  "id": "item-crab-meat",
  "name": "Crab Meat",
  "category": "food",
  "tier": 0,
  "stats": {
   "foodHp": 15,
   "foodStamina": 10,
   "foodMinutes": 8
  },
  "text": "Sweet, raw, and honest. Old Ghal is watching how you phrase that."
 },
 {
  "id": "item-smoked-crab",
  "name": "Smoked Crab",
  "category": "food",
  "tier": 1,
  "stats": {
   "foodHp": 35,
   "foodStamina": 25,
   "foodMinutes": 15
  },
  "text": "Salt and smoke and patience — a brinewife's answer to a hard day. Curing it fed Halor a little, too."
 },
 {
  "id": "item-eel-meat",
  "name": "Dust-Eel Meat",
  "category": "food",
  "tier": 0,
  "stats": {
   "foodHp": 10,
   "foodStamina": 18,
   "foodMinutes": 8
  },
  "text": "Chewy, quick energy. Tastes like the flats smell."
 },
 {
  "id": "item-smoked-eel",
  "name": "Smoked Eel",
  "category": "food",
  "tier": 1,
  "stats": {
   "foodHp": 25,
   "foodStamina": 40,
   "foodMinutes": 15
  },
  "text": "The reef-runners swear by it: a coil of it in the pack and the horizon gets closer."
 },
 {
  "id": "item-remnant-shellback",
  "name": "Remnant of the Shell",
  "category": "remnant",
  "tier": 1,
  "stackSize": 1,
  "remnantOf": "god-halor",
  "relic": {
   "points": 0.4
  },
  "text": "A divine fragment — the endurance of the old sea, shelled in something you can hold. Enshrine it at a chapel, or consume it, and hear a warm voice approve."
 },
 {
  "id": "item-harpoon-verse",
  "name": "Verse of the Harpoon-Song",
  "category": "relic",
  "tier": 1,
  "stackSize": 3,
  "text": "A fragment of an old whaler's song about a harpoon the Storm-Mother threw and lost. Three verses, they say, and the song teaches the forging. This one is yours now."
 },
 {
  "id": "item-marens-own-harpoon",
  "name": "Maren's Own Harpoon",
  "category": "weapon",
  "tier": 3,
  "stackSize": 1,
  "legend": {
   "godAffinity": "god-maren",
   "history": "She threw it once, at something that deserved it, and the storm has been looking for it ever since. Strike true and the bolt comes down on your mark."
  },
  "effects": [
   {
    "type": "lightning-on-hit",
    "magnitude": 1,
    "target": "enemy"
   }
  ],
  "text": "A legend of the storm-line.",
  "slot": "weapon",
  "stats": {
   "damage": 26
  }
 },
 {
  "id": "item-neriss-hourglass",
  "name": "Neris's Hourglass",
  "category": "relic",
  "tier": 3,
  "stackSize": 1,
  "legend": {
   "godAffinity": "god-neris",
   "history": "Filled with the last wet sand in the world. Turn it and, once a day, ten seconds agree to happen again."
  },
  "relic": {
   "points": 0.5
  },
  "text": "A legend of the tide-line."
 },
 {
  "id": "item-salt-fathers-hearthstone",
  "name": "The Salt-Father's Hearthstone",
  "category": "relic",
  "tier": 3,
  "stackSize": 1,
  "legend": {
   "godAffinity": "god-halor",
   "history": "A village heart. Set it in your hall and nothing within the walls spoils — food, stores, or resolve."
  },
  "relic": {
   "points": 0.5
  },
  "text": "A legend of the hearth-line."
 },
 {
  "id": "item-the-unlit-crown",
  "name": "The Unlit Crown",
  "category": "armor",
  "tier": 3,
  "stackSize": 1,
  "legend": {
   "godAffinity": "god-ur-noth",
   "history": "It costs what you'd expect. It gives more than you'd hope. That is how he works."
  },
  "text": "A legend of the dark-line.",
  "slot": "armor",
  "stats": {
   "defense": 10
  }
 },
 {
  "id": "item-lighthouse-keepers-lantern",
  "name": "The Lighthouse-Keeper's Lantern",
  "category": "tool",
  "tier": 1,
  "stackSize": 1,
  "legend": {
   "godAffinity": "god-halor",
   "history": "The keeper lit it the night the sea left, and swore it would burn until the water came back for it. He kept half the promise. The dark biomes respect it."
  },
  "effects": [
   {
    "type": "night-light-radius",
    "magnitude": 90,
    "target": "self"
   },
   {
    "type": "hound-aggro-mult",
    "magnitude": 0.75,
    "target": "self"
   }
  ],
  "text": "It never goes out.",
  "slot": "trinket"
 },
 {
  "id": "item-lantern-verse",
  "name": "Verse of the Keeper's Tale",
  "category": "relic",
  "tier": 1,
  "stackSize": 3,
  "text": "A fragment of the old song the lighthouse-keepers sang to each other across the dark. Three verses, they say, and the song teaches the rite that keeps a lantern lit forever. This one is yours now."
 },
 {
  "id": "item-driftwood-club",
  "name": "Driftwood Club",
  "category": "weapon",
  "tier": 0,
  "stackSize": 1,
  "stats": {
   "damage": 15
  },
  "text": "The sea's first gift to anyone in trouble: a heavy piece of somewhere else's boat.",
  "slot": "weapon"
 },
 {
  "id": "item-bronze-knife",
  "name": "Bronze Knife",
  "category": "weapon",
  "tier": 1,
  "stackSize": 1,
  "stats": {
   "damage": 19
  },
  "text": "Salvage-bronze, workbench-ground. It held a ship together; it will hold you together.",
  "slot": "weapon"
 },
 {
  "id": "item-salt-votive",
  "name": "Salt Votive",
  "category": "offering",
  "tier": 0,
  "offeringValue": 8,
  "text": "A small pressed cone of clean salt. The gods accept what the world has plenty of, if it is given with care."
 },
 {
  "id": "item-salt-ration",
  "name": "Salt Ration",
  "category": "food",
  "tier": 1,
  "stats": {
   "foodHp": 20,
   "foodStamina": 20,
   "foodMinutes": 12
  },
  "text": "Cured, wrapped, dependable. The taste of getting home anyway."
 },
 {
  "id": "item-salt-cloak",
  "name": "Salt-Crust Cloak",
  "category": "armor",
  "tier": 0,
  "stackSize": 1,
  "slot": "armor",
  "stats": {
   "defense": 3
  },
  "text": "Ship-cloth stiffened with salt until it turns a claw. Smells like the flats. Everything does."
 },
 {
  "id": "item-bronze-vest",
  "name": "Bronze-Scale Vest",
  "category": "armor",
  "tier": 1,
  "stackSize": 1,
  "slot": "armor",
  "stats": {
   "defense": 7
  },
  "text": "Salvage-bronze sewn to a cloth backing, scale over scale. Heavy, honest, and it has stopped worse than a hound."
 },
 {
  "id": "item-bronze-spear",
  "name": "Bronze Spear",
  "category": "weapon",
  "tier": 1,
  "stackSize": 1,
  "slot": "weapon",
  "stats": {
   "damage": 23
  },
  "text": "Reach, before the raiders learn you have it. Salvage-bronze on a driftwood haft, bound tight."
 },
 {
  "id": "item-bronze-mattock",
  "name": "Bronze Mattock",
  "category": "tool",
  "tier": 1,
  "stackSize": 1,
  "tool": {
   "tier": 2
  },
  "text": "A workbench-ground head on a good haft. Nothing in the Shallows needs it yet — the reef will. (Tool tier 2 — opens B2 nodes once the gather-gate lands at M3; inert for now.)"
 },
 {
  "id": "item-ship-cloth-bindings",
  "name": "Ship-Cloth Bindings",
  "category": "armor",
  "tier": 0,
  "stackSize": 1,
  "slot": "armor",
  "stats": {
   "defense": 5
  },
  "text": "Sailcloth wound tight and knotted the way a rigger knots a line — over the arms and chest, where a claw usually lands first."
 }
]